Secret Service agent on VP Pence's detail suspended after meeting a prostitute at a Maryland hotel, sources say…
World's top golfer Dustin Johnson injures his back after falling down stairs, just one day before the Masters begin…
House lawmakers will head home for two weeks on Thursday without a deal to repeal and replace Obamacare.…
"Nikki Haley threatens ""our own action"" in Syria if UN doesn’t act"
"Nikki Haley threatens ""our own action"" in Syria if UN doesn’t act"
Pepsi pulls controversial Kendall Jenner ad," says it ""missed the mark"""
"Trump blames Syrian leader for chemical attack: ""Heinous actions by the Assad regime cannot be tolerated""…"
US Ambassador Nikki Haley: If the UN won't act on Syria," ""we may"""
Steve Bannon has been bumped from the National Security Council, according to a senior administration official.…
Barry Manilow kept his sexuality a secret for years, but now he's opening up about his life and longtime love…
6 people were killed when a suicide bomber struck the Pakistani city of Lahore, an official says.
Russia blames Syrian airstrike on chemical weapons factory for deaths.
Preliminary safety trial at Duke University involving stem cell infusions shows early promise for kids with autism
Electronics ban could expand to include more airports and devices, Department of Homeland Security says…
LGBT employees protected from workplace discrimination, appeals court rules
