France's Le Pen says lacks election funds, has no Russian backing
North Korea tests rocket engine: U.S. officials
On outskirts of Lima, hundreds salvage what is left of their homes after Peru's worst flooding disaster in decades…
Bill Gross, Pimco settle lawsuit over his exit for $81 million: sources
Wall Street off as Trump agenda weighed; Dow down for eighth day
Senators press Icahn on White House influence, business conflicts
Brazil suspends three more meat plants in bribery scandal
On outskirts of Lima, hundreds salvage what is left of their homes after Peru's worst flooding disaster in decades…
How two teens in leggings became a PR mess for United Airlines
More Democrats oppose Trump's U.S. Supreme Court pick
Elon Musk's new co could allow uploading, downloading thoughts: Wall Street Journal
Trump's son-in-law to oversee government revamp: official
PHOTOS: Inside the protests where Russian police detained hundreds of people
U.S. attorney general says sanctuary cities may lose federal grants
BREAKING: Senate Democratic Leader Schumer calls for removal of Nunes as chairman of House Intelligence Committee
Snap surges after IPO banks give flurry of 'buy' ratings
France's Le Pen says lacks election funds, has no Russian backing
After civilians killed in Mosul, Pentagon denies loosening rules in fight vs IS
Turks in Germany start voting in referendum to boost Erdogan powers
With less than four weeks to go before voting begins, France's Le Pen says she lacks election funds:…
How Trump's threatened withdrawal from the Paris Agreement might actually help the pact:
Syria's Raqqa expected to join Kurdish-led federalism: Kurdish leader
'There is nothing left': Residents salvage scant belongings after Peru's worst flooding in decades:…
U.S. top court considers changing where patent cases may be filed
House Intelligence Committee Chairman Nunes reviewed sensitive file on White House grounds:
Once golden, Robert Rubin's hedge fund proteges lose some luster
The 'religious left' is now slowly coming together as a force in U.S. politics
China state firms eye land around Panama Canal: waterway authority
U.S., Britain, France, others skip nuclear weapons ban treaty talks
As the White House tries to refocus attention from healthcare to tax reform, investor faith is wavering:…
Trump's son-in-law to oversee government revamp: official
After healthcare loss, investor faith wavers as Trump turns to taxes
Trump will sign an order on Tuesday to ease energy regulations, say officials:
Two remain critically wounded from deadly Ohio nightclub shooting
Wall Street hits a six-week low on Trump's healthcare bill defeat:
Uber resumes self-driving car program in San Francisco after crash
Wall St. hits six-week low on Trump's healthcare bill defeat
Facebook's Messenger app to allow live location-sharing
The rise of the 'religious left' in the Trump era:
Reuters Select: Twilight of the Goldman hedge fund stars:
After healthcare defeat, the White House looks past conservatives on tax reform - to Democrats:…
Dollar skids to four-month low as Trump trade deflates
Saudi Arabia sweetens huge Aramco IPO with a tax cut:
United Airlines responds to backlash after barring teenage girls wearing leggings from flight…
United Airlines responds to backlash after barring teenage girls in leggings from flight:
Senate panel is seeking to interview Trump's son-in-law Kushner on Russia:
Putin critic Navalny jailed for 15 days after protests across Russia:
Samsung Electronics says to sell refurbished Galaxy Note 7s
VW's Audi halts A4, A5 production at Ingolstadt over parts shortage
Senate panel to question Trump son-in-law on Russians: official
Turks in Germany start voting in referendum on boosting Erdogan's powers. Via @ReutersTV
Syria's Raqqa expected to join Kurdish-led federalism: Kurdish leader
Emaar Malls' $800 million bid for
NATO to spend 3 billion euros on satellite, cyber defenses
Once golden, Robert Rubin's hedge fund proteges lose some luster:
Decision on Monte Paschi rescue soon; Vicenza and Veneto next: ECB
Trump's son-in-law to oversee White House office to revamp government: report
Hong Kong protest leaders ominously told they face charges day after new leader chosen. Via @ReutersTV…
Life under Russia not all it was cracked up to be: Crimean ex-leader
U.S. tourist killed in London would not have borne ill feelings toward attacker: family
South Africa's Zuma recalls Gordhan from international roadshow, rand falls
'Religious left' emerging as U.S. political force in Trump era
'Religious Left' rises to fight Trump's policies. See more from @ReutersTV:
Dollar hits four-month low as Trump trade deflates
Kremlin rejects U.S., EU calls to free detained opposition protesters
Swiss investigate protest sign calling for Erdogan's killing
⚡️ “Daily Briefing - global news headlines”
Northeast Australia braces for cyclone, thousands flee to higher ground
South Korean leaders want ex-leader Park in jail. Read more:
Honda faces long haul to recoup jet costs
Stocks stumble on U.S. policy woes; Trumpflation trades suffer
China Southern in talks over American Airlines tie-up
Daily Briefing: Northern Ireland talks stall, pro-EU camp wins in Bulgaria and pall cast over 'Trumpflation' trades…
Mexicans who help build Trump wall 'traitors,' top Archdiocese says
Hong Kong protest leaders ominously told they face charges day after new leader chosen
Once golden, Robert Rubin's hedge fund proteges lose some luster
'Now or never' for Europe, French think tank warns
United Airlines bars teenage girls in leggings from flight
U.S. equity futures at six-week low after Trump healthcare setback
Toshiba's Westinghouse may file bankruptcy Tuesday, seeks Kepco aid: Nikkei
China stops individuals from buying Beijing commercial property
Honda faces long haul to recoup jet costs
Thousands flee as Cyclone Debbie bears down on Australia
Stocks stumble on U.S. policy woes; Trumpflation trades suffer
Trump to sign order on Tuesday easing energy regulations: officials
Mexicans who help build Trump wall 'traitors,' top Archdiocese says
Hyundai Motor suspends another China plant amid political tension: report
South Korea prosecutors seek detention warrant for ousted president Park
Japanese manufacturers brace for possible U.S. import tax: Reuters poll
United Airlines bars teenage girls in leggings from flight
Gunfire in crowded Ohio nightclub kills one, wounds 15
Equities take a spill on Trump healthcare setback; bonds shine
U.S. equity futures at six-week low after Trump healthcare setback
Republican lawmaker quits conservative House group over healthcare conflict
Toshiba's Westinghouse may file bankruptcy Tuesday, seeks Kepco aid: Nikkei
